{
  "protocolVersion": "1.0",
  "eventId": "018f4d85-4f31-7a1d-8f11-4d4ac3f10f55",
  "call": "metric",
  "event": "workspace_activation_seconds",
  "eventVersion": 1,
  "occurredAt": "2026-08-04T12:35:06.000Z",
  "userId": "customer_123",
  "accountId": "company_456",
  "metric": {
    "name": "time_to_activation",
    "value": 183.5,
    "unit": "seconds",
    "dimensions": { "plan": "team" }
  },
  "context": {
    "library": { "name": "@seemplify/node", "version": "0.1.0" }
  }
}
