{
  "protocolVersion": "1.0",
  "eventId": "018f4d85-4f31-7a1d-8f11-4d4ac3f10f54",
  "call": "consent",
  "occurredAt": "2026-08-04T12:35:05.000Z",
  "userId": "customer_123",
  "consent": {
    "analytics": "granted",
    "personalisation": "denied",
    "researchContact": "unknown",
    "source": "settings_privacy_center",
    "updatedAt": "2026-08-04T12:35:05.000Z"
  }
}
