{
  "protocolVersion": "1.0",
  "eventId": "018f4d85-4f31-7a1d-9f11-4d4ac3f10f48",
  "call": "track",
  "event": "workspace_created",
  "eventVersion": 1,
  "occurredAt": "2026-08-04T12:34:56.123Z",
  "sentAt": "2026-08-04T12:34:56.456Z",
  "anonymousId": "anon_7fdb",
  "userId": "customer_123",
  "accountId": "company_456",
  "sessionId": "session_789",
  "properties": {
    "workspaceType": "team",
    "source": "onboarding"
  },
  "context": {
    "locale": "en-GB",
    "timezone": "Europe/London",
    "page": {
      "url": "https://example.com/onboarding",
      "referrer": "https://example.com/"
    },
    "device": { "type": "desktop" },
    "library": { "name": "@seemplify/browser", "version": "0.1.0" }
  },
  "consent": {
    "analytics": "granted",
    "personalisation": "unknown",
    "source": "customer_cmp",
    "updatedAt": "2026-08-04T12:30:00.000Z"
  }
}
